<?xml version="1.0" encoding="UTF-8"?>
<exm:examinerCV xmlns="http://webspace.stu.qmul.ac.uk/~ac08162/amcm043/coursework2/examiner"
    xmlns:xsi="http://www.w3.org/2001/XMLSchema-instance"
    xmlns:exm="http://webspace.stu.qmul.ac.uk/~ac08162/amcm043/coursework2/examiner"
    xsi:schemaLocation="http://webspace.stu.qmul.ac.uk/~ac08162/amcm043/coursework2/examiner examiners.xsd">
    <exm:examiner>
        <exm:personalDetails>
            <exm:localIdentificationNumber>1</exm:localIdentificationNumber>
            <exm:personalIdentification>
                <exm:identificationNumber>AB123456J</exm:identificationNumber>
                <exm:identificationType>National Insurance Number</exm:identificationType>
                <exm:issuingAuthority>UK Government</exm:issuingAuthority>
            </exm:personalIdentification>
            <exm:personName>
                <exm:title>Dr</exm:title>
                <exm:firstName>Harry</exm:firstName>
                <exm:secondaryName>James</exm:secondaryName>
                <exm:surname>Nesbitt</exm:surname>
            </exm:personName>
        </exm:personalDetails>
        <exm:subjectArea>Inorganic Chemistry</exm:subjectArea>
        <exm:academicPost>
            <exm:currentPost>
                <exm:position>Senior Lecturer</exm:position>
                <exm:institution>The Royal Veterinary College</exm:institution>
            </exm:currentPost>
            <exm:previousPost>
                <exm:position>Lecturer</exm:position>
                <exm:institution>University of Brisol</exm:institution>
            </exm:previousPost>
        </exm:academicPost>
        <exm:PhDDetail>
            <exm:institution>University of Brisol</exm:institution>
            <exm:PhDExaminar>
                <exm:localIdentificationNumber>300</exm:localIdentificationNumber>
                <exm:personalIdentification>
                    <exm:identificationNumber>GH456234K</exm:identificationNumber>
                    <exm:identificationType>National Insurance Number</exm:identificationType>
                    <exm:issuingAuthority>UK Government</exm:issuingAuthority>
                </exm:personalIdentification>
                <exm:personName>
                    <exm:title>Dr</exm:title>
                    <exm:firstName>James</exm:firstName>
                    <exm:surname>Bourne</exm:surname>
                </exm:personName>
            </exm:PhDExaminar>
            <exm:PhDExaminar>
                <exm:localIdentificationNumber>310</exm:localIdentificationNumber>
                <exm:personalIdentification>
                    <exm:identificationNumber>FH455234K</exm:identificationNumber>
                    <exm:identificationType>National Insurance Number</exm:identificationType>
                    <exm:issuingAuthority>UK Government</exm:issuingAuthority>
                </exm:personalIdentification>
                <exm:personName>
                    <exm:title>Dr</exm:title>
                    <exm:firstName>Jason</exm:firstName>
                    <exm:surname>Bond</exm:surname>
                </exm:personName>
            </exm:PhDExaminar>
            <exm:PhDSupervisor>
                <exm:localIdentificationNumber>320</exm:localIdentificationNumber>
                <exm:personalIdentification>
                    <exm:identificationNumber>123456789</exm:identificationNumber>
                    <exm:identificationType>Passport Number</exm:identificationType>
                    <exm:issuingAuthority>UK Government</exm:issuingAuthority>
                </exm:personalIdentification>
                <exm:personName>
                    <title>Miss</title>
                    <firstName>Alicia</firstName>
                    <surname>Keys</surname>
                </exm:personName>
            </exm:PhDSupervisor>
        </exm:PhDDetail>
        <previousExperience>
            <experience>
                <subjectArea>Inorganic Chemistry</subjectArea>
                <institution>University of Bristol</institution>
                <examinationDate>2007-10-02</examinationDate>
            </experience>
            <experience>
                <subjectArea>Inorganic Chemistry</subjectArea>
                <institution>University of Bristol</institution>
                <examinationDate>2007-03-02</examinationDate>
            </experience>
            <experience>
                <subjectArea>Inorganic Chemistry</subjectArea>
                <institution>University of Bath</institution>
                <examinationDate>2006-05-02</examinationDate>
            </experience>
        </previousExperience>
    </exm:examiner>

    <exm:examiner>
        <exm:personalDetails>
            <exm:localIdentificationNumber>2</exm:localIdentificationNumber>
            <exm:personalIdentification>
                <exm:identificationNumber>GH128856J</exm:identificationNumber>
                <exm:identificationType>National Insurance Number</exm:identificationType>
                <exm:issuingAuthority>UK Government</exm:issuingAuthority>
            </exm:personalIdentification>
            <exm:personName>
                <exm:title>Dr</exm:title>
                <exm:firstName>Karen</exm:firstName>
                <exm:secondaryName>Alison</exm:secondaryName>
                <exm:surname>Doyle</exm:surname>
            </exm:personName>
        </exm:personalDetails>
        <exm:subjectArea>Inorganic Chemistry</exm:subjectArea>
        <exm:academicPost>
            <exm:currentPost>
                <exm:position>Senior Lecturer</exm:position>
                <exm:institution>University of Brighton</exm:institution>
            </exm:currentPost>
            <exm:previousPost>
                <exm:position>Lecturer</exm:position>
                <exm:institution>Imperial College</exm:institution>
            </exm:previousPost>
        </exm:academicPost>
        <exm:PhDDetail>
            <exm:institution>Imperial College</exm:institution>
            <exm:PhDExaminar>
                <exm:localIdentificationNumber>200</exm:localIdentificationNumber>
                <exm:personalIdentification>
                    <exm:identificationNumber>HH467234K</exm:identificationNumber>
                    <exm:identificationType>National Insurance Number</exm:identificationType>
                    <exm:issuingAuthority>UK Government</exm:issuingAuthority>
                </exm:personalIdentification>
                <exm:personName>
                    <exm:title>Dr</exm:title>
                    <exm:firstName>Andrew</exm:firstName>
                    <exm:surname>Parker</exm:surname>
                </exm:personName>
            </exm:PhDExaminar>
            <exm:PhDExaminar>
                <exm:localIdentificationNumber>210</exm:localIdentificationNumber>
                <exm:personalIdentification>
                    <exm:identificationNumber>345676543</exm:identificationNumber>
                    <exm:identificationType>Passport Number</exm:identificationType>
                    <exm:issuingAuthority>UK Government</exm:issuingAuthority>
                </exm:personalIdentification>
                <exm:personName>
                    <exm:title>Dr</exm:title>
                    <exm:firstName>Jason</exm:firstName>
                    <exm:surname>Bond</exm:surname>
                </exm:personName>
            </exm:PhDExaminar>
            <exm:PhDSupervisor>
                <exm:localIdentificationNumber>220</exm:localIdentificationNumber>
                <exm:personalIdentification>
                    <exm:identificationNumber>123445789</exm:identificationNumber>
                    <exm:identificationType>Passport Number</exm:identificationType>
                    <exm:issuingAuthority>UK Government</exm:issuingAuthority>
                </exm:personalIdentification>
                <exm:personName>
                    <exm:title>Dr</exm:title>
                    <exm:firstName>Gordon</exm:firstName>
                    <exm:surname>Cameron</exm:surname>
                </exm:personName>
            </exm:PhDSupervisor>
        </exm:PhDDetail>
    </exm:examiner>

    <exm:examiner>
        <exm:personalDetails>
            <exm:localIdentificationNumber>3</exm:localIdentificationNumber>
            <exm:personalIdentification>
                <exm:identificationNumber>PW168856H</exm:identificationNumber>
                <exm:identificationType>National Insurance Number</exm:identificationType>
                <exm:issuingAuthority>UK Government</exm:issuingAuthority>
            </exm:personalIdentification>
            <exm:personName>
                <exm:title>Dr</exm:title>
                <exm:firstName>Tony</exm:firstName>
                <exm:secondaryName>Nelson</exm:secondaryName>
                <exm:surname>Mandelson</exm:surname>
            </exm:personName>
        </exm:personalDetails>
        <exm:subjectArea>Organic Chemistry</exm:subjectArea>
        <exm:academicPost>
            <exm:currentPost>
                <exm:position>Senior Lecturer</exm:position>
                <exm:institution>University of Leicester</exm:institution>
            </exm:currentPost>
            <exm:previousPost>
                <exm:position>Lecturer</exm:position>
                <exm:institution>University of Durham</exm:institution>
            </exm:previousPost>
        </exm:academicPost>
        <exm:PhDDetail>
            <exm:institution>Imperial College</exm:institution>
            <exm:PhDExaminar>
                <exm:localIdentificationNumber>100</exm:localIdentificationNumber>
                <exm:personalIdentification>
                    <exm:identificationNumber>HJ465234K</exm:identificationNumber>